{
  "$comment": [
    "Adjust temperature to alter model behaviour:",
    "  0.0 = greedy (deterministic)",
    "  1.0 = baseline",
    "  2.0 = uncertain",
    "  2.5 = dumb",
    "  3+ = garbage (too random)"
  ],
  "models": {
    "attacker": "attacker-nkjrmrsq-202509291846.onnx",
    "defender": "defender-tukbajrv-202509241418.onnx"
  },
  "fallback": "BattleAI",
  "temperature": 0.5,
  "maxPredictions": 1000,
  "seed": 0
}
